{
  "problem": "SYNTHETIC: reduce repeated deterministic feature computation",
  "challenge": [
    "Check whether keyed feature reuse is already present"
  ],
  "domain": "machine learning",
  "seed_sources": [],
  "existing_ideas": [
    "Rename keyed feature memoization as feature memory."
  ],
  "target_contribution": "A falsifiable mechanism or a justified diagnostic.",
  "constraints": {
    "data": [],
    "code": [],
    "hardware": null,
    "time": null,
    "other": [
      "Use a bounded literature budget."
    ]
  },
  "excluded_directions": [],
  "language": "en",
  "output_directory": "runs"
}
